{
  "$schema": "https://json-schema.org/draft/2020-12/schema",
  "title": "Manual fixture_schedule version 1",
  "description": "Structural authoring schema. The Python parser and trusted-profile validation are mandatory; see the preparation guide for semantic constraints.",
  "type": "object",
  "additionalProperties": false,
  "required": [
    "import_type",
    "schema_version",
    "submission_id",
    "namespace",
    "scope",
    "boundaries",
    "provenance",
    "fixtures",
    "review_plan"
  ],
  "properties": {
    "import_type": {
      "const": "fixture_schedule"
    },
    "schema_version": {
      "type": "integer",
      "const": 1
    },
    "submission_id": {
      "type": "string",
      "pattern": "^[A-Za-z0-9][A-Za-z0-9_.-]{0,127}$",
      "maxLength": 128
    },
    "namespace": {
      "type": "string",
      "pattern": "^[A-Za-z0-9][A-Za-z0-9_.-]{0,127}$",
      "maxLength": 128
    },
    "scope": {
      "type": "object",
      "additionalProperties": false,
      "required": [
        "sport_key",
        "competition_key",
        "season_key",
        "observation_scope"
      ],
      "properties": {
        "sport_key": {
          "type": "string",
          "pattern": "^[A-Za-z0-9][A-Za-z0-9_.-]{0,127}$",
          "maxLength": 128
        },
        "competition_key": {
          "type": "string",
          "pattern": "^[A-Za-z0-9][A-Za-z0-9_.-]{0,127}$",
          "maxLength": 128
        },
        "season_key": {
          "type": "string",
          "pattern": "^[A-Za-z0-9][A-Za-z0-9_.-]{0,127}$",
          "maxLength": 128
        },
        "observation_scope": {
          "const": "partial"
        }
      }
    },
    "boundaries": {
      "type": "array",
      "minItems": 1,
      "maxItems": 256,
      "uniqueItems": true,
      "items": {
        "$ref": "#/$defs/boundary"
      }
    },
    "provenance": {
      "$ref": "#/$defs/provenance"
    },
    "fixtures": {
      "type": "array",
      "minItems": 0,
      "maxItems": 2000,
      "items": {
        "$ref": "#/$defs/fixture"
      }
    },
    "review_plan": {
      "$ref": "#/$defs/review_plan"
    }
  },
  "allOf": [
    {
      "if": {
        "properties": {
          "fixtures": {
            "type": "array",
            "maxItems": 0
          }
        }
      },
      "then": {
        "properties": {
          "review_plan": {
            "type": "object",
            "properties": {
              "state": {
                "const": "active"
              }
            }
          }
        }
      }
    }
  ],
  "$defs": {
    "boundary": {
      "type": "object",
      "additionalProperties": false,
      "required": [
        "stage",
        "round_name",
        "stage_kind"
      ],
      "properties": {
        "stage": {
          "type": "string",
          "pattern": "^[A-Za-z0-9][A-Za-z0-9_.-]{0,127}$",
          "maxLength": 128
        },
        "round_name": {
          "type": "string",
          "pattern": "^[A-Za-z0-9][A-Za-z0-9_.-]{0,127}$",
          "maxLength": 128
        },
        "stage_kind": {
          "enum": [
            null,
            "qualifying",
            "playoff",
            "league_phase",
            "knockout_playoff",
            "knockout",
            "final"
          ]
        }
      }
    },
    "participant": {
      "oneOf": [
        {
          "type": "object",
          "additionalProperties": false,
          "required": [
            "resolution",
            "participant_key"
          ],
          "properties": {
            "resolution": {
              "const": "resolved"
            },
            "participant_key": {
              "type": "string",
              "pattern": "^[A-Za-z0-9][A-Za-z0-9_.-]{0,127}$",
              "maxLength": 128
            }
          }
        },
        {
          "type": "object",
          "additionalProperties": false,
          "required": [
            "resolution",
            "participant_key"
          ],
          "properties": {
            "resolution": {
              "const": "unresolved"
            },
            "participant_key": {
              "type": "null"
            }
          }
        }
      ]
    },
    "provenance": {
      "type": "object",
      "additionalProperties": false,
      "required": [
        "issuer",
        "document_ref",
        "rights_ref",
        "attribution",
        "document_sha256",
        "checksum_unavailable_reason",
        "observed_at",
        "prepared_at"
      ],
      "properties": {
        "issuer": {
          "type": "string",
          "minLength": 1,
          "maxLength": 256
        },
        "document_ref": {
          "type": "string",
          "pattern": "^[A-Za-z0-9][A-Za-z0-9_.-]{0,127}$",
          "maxLength": 128
        },
        "rights_ref": {
          "type": "string",
          "pattern": "^[A-Za-z0-9][A-Za-z0-9_.-]{0,127}$",
          "maxLength": 128
        },
        "attribution": {
          "type": "string",
          "minLength": 1,
          "maxLength": 512
        },
        "document_sha256": {
          "anyOf": [
            {
              "type": "string",
              "pattern": "^[0-9a-f]{64}$",
              "maxLength": 64
            },
            {
              "type": "null"
            }
          ]
        },
        "checksum_unavailable_reason": {
          "anyOf": [
            {
              "type": "string",
              "minLength": 1,
              "maxLength": 256
            },
            {
              "type": "null"
            }
          ]
        },
        "observed_at": {
          "type": "string",
          "pattern": "^\\d{4}-\\d{2}-\\d{2}T\\d{2}:\\d{2}:\\d{2}(Z|\\+00:00|-00:00)$"
        },
        "prepared_at": {
          "type": "string",
          "pattern": "^\\d{4}-\\d{2}-\\d{2}T\\d{2}:\\d{2}:\\d{2}(Z|\\+00:00|-00:00)$"
        }
      },
      "allOf": [
        {
          "if": {
            "properties": {
              "document_sha256": {
                "type": "null"
              }
            }
          },
          "then": {
            "properties": {
              "checksum_unavailable_reason": {
                "type": "string",
                "minLength": 1,
                "maxLength": 256
              }
            }
          },
          "else": {
            "properties": {
              "checksum_unavailable_reason": {
                "type": "null"
              }
            }
          }
        }
      ]
    },
    "fixture": {
      "type": "object",
      "additionalProperties": false,
      "required": [
        "fixture_id",
        "boundary",
        "home",
        "away",
        "kickoff",
        "timezone",
        "kickoff_confirmed",
        "status",
        "group",
        "tie_key",
        "leg",
        "venue",
        "city"
      ],
      "properties": {
        "fixture_id": {
          "type": "string",
          "pattern": "^[A-Za-z0-9][A-Za-z0-9_.-]{0,127}$",
          "maxLength": 128
        },
        "boundary": {
          "$ref": "#/$defs/boundary"
        },
        "home": {
          "$ref": "#/$defs/participant"
        },
        "away": {
          "$ref": "#/$defs/participant"
        },
        "kickoff": {
          "anyOf": [
            {
              "type": "string",
              "pattern": "^\\d{4}-\\d{2}-\\d{2}T\\d{2}:\\d{2}:\\d{2}(Z|[+-]\\d{2}:\\d{2})$"
            },
            {
              "type": "null"
            }
          ]
        },
        "timezone": {
          "type": "string",
          "minLength": 1,
          "maxLength": 64
        },
        "kickoff_confirmed": {
          "type": "boolean"
        },
        "status": {
          "enum": [
            "scheduled",
            "postponed",
            "cancelled"
          ]
        },
        "group": {
          "anyOf": [
            {
              "type": "string",
              "pattern": "^[A-Za-z0-9][A-Za-z0-9_.-]{0,127}$",
              "maxLength": 128
            },
            {
              "type": "null"
            }
          ]
        },
        "tie_key": {
          "anyOf": [
            {
              "type": "string",
              "pattern": "^[A-Za-z0-9][A-Za-z0-9_.-]{0,127}$",
              "maxLength": 128
            },
            {
              "type": "null"
            }
          ]
        },
        "leg": {
          "enum": [
            null,
            "single",
            "first",
            "second"
          ]
        },
        "venue": {
          "anyOf": [
            {
              "type": "string",
              "minLength": 1,
              "maxLength": 256
            },
            {
              "type": "null"
            }
          ]
        },
        "city": {
          "anyOf": [
            {
              "type": "string",
              "minLength": 1,
              "maxLength": 256
            },
            {
              "type": "null"
            }
          ]
        }
      },
      "allOf": [
        {
          "if": {
            "properties": {
              "kickoff_confirmed": {
                "const": true
              }
            }
          },
          "then": {
            "properties": {
              "kickoff": {
                "type": "string",
                "pattern": "^\\d{4}-\\d{2}-\\d{2}T\\d{2}:\\d{2}:\\d{2}(Z|[+-]\\d{2}:\\d{2})$"
              }
            }
          },
          "else": {
            "properties": {
              "kickoff": {
                "type": "null"
              }
            }
          }
        },
        {
          "if": {
            "properties": {
              "leg": {
                "enum": [
                  "first",
                  "second"
                ]
              }
            }
          },
          "then": {
            "properties": {
              "tie_key": {
                "type": "string",
                "pattern": "^[A-Za-z0-9][A-Za-z0-9_.-]{0,127}$",
                "maxLength": 128
              }
            }
          }
        },
        {
          "if": {
            "properties": {
              "tie_key": {
                "type": "string"
              }
            }
          },
          "then": {
            "properties": {
              "leg": {
                "enum": [
                  "single",
                  "first",
                  "second"
                ]
              }
            }
          }
        },
        {
          "if": {
            "properties": {
              "status": {
                "const": "cancelled"
              }
            }
          },
          "then": {
            "properties": {
              "home": {
                "properties": {
                  "resolution": {
                    "const": "resolved"
                  }
                },
                "type": "object"
              },
              "away": {
                "properties": {
                  "resolution": {
                    "const": "resolved"
                  }
                },
                "type": "object"
              }
            }
          }
        }
      ]
    },
    "review_plan": {
      "type": "object",
      "additionalProperties": false,
      "required": [
        "state",
        "tasks",
        "completion_note"
      ],
      "properties": {
        "state": {
          "enum": [
            "active",
            "complete"
          ]
        },
        "tasks": {
          "type": "array",
          "maxItems": 32,
          "items": {
            "$ref": "#/$defs/review_task"
          }
        },
        "completion_note": {
          "anyOf": [
            {
              "type": "string",
              "minLength": 1,
              "maxLength": 256
            },
            {
              "type": "null"
            }
          ]
        }
      },
      "allOf": [
        {
          "if": {
            "properties": {
              "state": {
                "const": "active"
              }
            }
          },
          "then": {
            "properties": {
              "tasks": {
                "minItems": 1,
                "type": "array"
              },
              "completion_note": {
                "type": "null"
              }
            }
          },
          "else": {
            "properties": {
              "tasks": {
                "maxItems": 0,
                "type": "array"
              },
              "completion_note": {
                "type": "string",
                "minLength": 1,
                "maxLength": 256
              }
            }
          }
        }
      ]
    },
    "review_task": {
      "type": "object",
      "additionalProperties": false,
      "required": [
        "task_id",
        "due_at",
        "reason",
        "target_stage",
        "target_round",
        "note",
        "reminder_minutes"
      ],
      "properties": {
        "task_id": {
          "type": "string",
          "pattern": "^[A-Za-z0-9][A-Za-z0-9_.-]{0,127}$",
          "maxLength": 128
        },
        "due_at": {
          "type": "string",
          "pattern": "^\\d{4}-\\d{2}-\\d{2}T\\d{2}:\\d{2}:\\d{2}(Z|\\+00:00|-00:00)$"
        },
        "reason": {
          "enum": [
            "kickoff_confirmation",
            "next_round_draw",
            "return_leg_schedule",
            "periodic_review"
          ]
        },
        "target_stage": {
          "anyOf": [
            {
              "type": "string",
              "pattern": "^[A-Za-z0-9][A-Za-z0-9_.-]{0,127}$",
              "maxLength": 128
            },
            {
              "type": "null"
            }
          ]
        },
        "target_round": {
          "anyOf": [
            {
              "type": "string",
              "pattern": "^[A-Za-z0-9][A-Za-z0-9_.-]{0,127}$",
              "maxLength": 128
            },
            {
              "type": "null"
            }
          ]
        },
        "note": {
          "anyOf": [
            {
              "type": "string",
              "minLength": 1,
              "maxLength": 256
            },
            {
              "type": "null"
            }
          ]
        },
        "reminder_minutes": {
          "type": "integer",
          "minimum": 0,
          "maximum": 10080
        }
      },
      "allOf": [
        {
          "if": {
            "properties": {
              "target_round": {
                "type": "string"
              }
            }
          },
          "then": {
            "properties": {
              "target_stage": {
                "type": "string",
                "pattern": "^[A-Za-z0-9][A-Za-z0-9_.-]{0,127}$",
                "maxLength": 128
              }
            }
          }
        }
      ]
    }
  }
}
